{
  "evaluation_id": "TODO_EVALUATION_ID",
  "evaluation_design": "monitoring",
  "evidence_context": {
    "source_kind": "enterprise_operational",
    "mapping_assessment_required": true
  },
  "publication_policy": {
    "minimum_evidence_tier": "partial"
  },
  "measurement_window": {
    "start": "2026-01-01T00:00:00Z",
    "end": "2026-01-08T00:00:00Z",
    "timezone": "UTC"
  },
  "baseline": {
    "name": "TODO_BASELINE_NAME",
    "type": "manual_process",
    "definition": "TODO baseline definition"
  },
  "comparator": {
    "name": "TODO_AGENT_CONFIGURATION",
    "type": "agent_configuration",
    "definition": "TODO comparator definition"
  },
  "assumptions": {
    "manual_baseline_cycle_time_seconds": 0,
    "manual_baseline_human_effort_seconds": 0,
    "loaded_labor_rate_usd_per_hour": 0
  },
  "telemetry_requirements": {
    "required": [
      "run_id",
      "timestamp",
      "workflow_definition_id",
      "trace_id",
      "event_type",
      "status",
      "step_name",
      "agent_configuration_id",
      "agent_version",
      "configuration_hash",
      "input_tokens",
      "output_tokens"
    ],
    "optional": [
      "business_success",
      "human_effort_seconds",
      "observed_cost_usd",
      "quality_score",
      "failure_mode",
      "tool_call_trace",
      "intervention_markers",
      "retry_markers"
    ]
  },
  "configuration": {
    "agent_configuration_id": "TODO_AGENT_CONFIG",
    "agent_version": "TODO_AGENT_VERSION",
    "configuration_hash": "TODO_CONFIGURATION_HASH"
  },
  "taxonomy": {
    "deployment_mode": "embedded_automation",
    "workflow_integration": "TODO_WORKFLOW",
    "autonomy_level": "bounded_autonomy",
    "hitl_pattern": "TODO_HITL_PATTERN",
    "statefulness": "workflow_stateful",
    "memory_strategy": "TODO_MEMORY_STRATEGY",
    "composition": "single_agent_with_tools",
    "decomposition_strategy": "TODO_DECOMPOSITION",
    "allocation_mechanism": "TODO_ALLOCATION",
    "routing_strategy": "TODO_ROUTING",
    "protocol_surfaces": []
  },
  "inclusion_rules": [
    "Include runs that start and end within the measurement window."
  ],
  "exclusion_rules": [
    "Exclude test traffic and runs affected by known configuration drift."
  ],
  "run_exclusions": [],
  "interpretation_boundaries": [
    "Monitoring design supports descriptive evidence only unless paired with a defensible comparator."
  ],
  "concurrent_changes": []
}
