{
  "evaluation_id": "TODO_STAGED_ROLLOUT_ID",
  "evaluation_design": "staged_rollout",
  "evidence_context": {
    "source_kind": "enterprise_operational",
    "mapping_assessment_required": true
  },
  "publication_policy": {
    "minimum_evidence_tier": "partial"
  },
  "measurement_window": {
    "start": "2026-01-01T00:00:00Z",
    "end": "2026-01-31T00:00:00Z",
    "timezone": "UTC"
  },
  "baseline": {
    "name": "pre_rollout_or_control_window",
    "type": "staged_rollout_baseline",
    "definition": "Runs before rollout or in a not-yet-treated cohort.",
    "agent_configuration_id": "baseline-agent.v1"
  },
  "comparator": {
    "name": "post_rollout_or_treated_window",
    "type": "staged_rollout_comparator",
    "definition": "Runs after rollout or in the treated cohort.",
    "agent_configuration_id": "rollout-agent.v1"
  },
  "assumptions": {
    "manual_baseline_cycle_time_seconds": 0,
    "manual_baseline_human_effort_seconds": 0,
    "loaded_labor_rate_usd_per_hour": 0
  },
  "telemetry_requirements": {
    "required": [
      "run_id",
      "timestamp",
      "workflow_definition_id",
      "trace_id",
      "event_type",
      "status",
      "step_name",
      "agent_configuration_id",
      "agent_version",
      "configuration_hash"
    ],
    "optional": [
      "business_success",
      "human_effort_seconds",
      "input_tokens",
      "output_tokens",
      "observed_cost_usd",
      "quality_score",
      "failure_mode",
      "tool_call_trace"
    ]
  },
  "configuration": {
    "agent_configuration_id": "rollout-agent.v1",
    "agent_version": "TODO_AGENT_VERSION",
    "configuration_hash": "TODO_CONFIGURATION_HASH"
  },
  "taxonomy": {
    "deployment_mode": "embedded_automation",
    "workflow_integration": "TODO_WORKFLOW",
    "autonomy_level": "bounded_autonomy",
    "hitl_pattern": "TODO_HITL_PATTERN",
    "statefulness": "workflow_stateful",
    "memory_strategy": "TODO_MEMORY_STRATEGY",
    "composition": "single_agent_with_tools",
    "decomposition_strategy": "TODO_DECOMPOSITION",
    "allocation_mechanism": "TODO_ALLOCATION",
    "routing_strategy": "TODO_ROUTING",
    "protocol_surfaces": []
  },
  "inclusion_rules": [
    "Include rollout cohorts with consistent workflow boundaries."
  ],
  "exclusion_rules": [
    "Exclude runs affected by known prompt, model, or tool drift outside the planned rollout."
  ],
  "run_exclusions": [],
  "interpretation_boundaries": [
    "Staged rollout evidence must document learning effects, workflow drift, and concurrent changes."
  ],
  "concurrent_changes": [
    "TODO document concurrent operational changes."
  ]
}
