{
  "evaluation_id": "thesis-readiness-window-exclusions",
  "evaluation_design": "monitoring",
  "measurement_window": {
    "start": "2026-04-05T00:00:00Z",
    "end": "2026-04-06T00:00:00Z",
    "timezone": "UTC"
  },
  "baseline": {
    "name": "not_applicable",
    "type": "monitoring_reference",
    "definition": "No causal baseline is used."
  },
  "comparator": {
    "name": "window_agent",
    "type": "agent_configuration",
    "definition": "Synthetic runs used to prove explicit and temporal exclusions."
  },
  "assumptions": {},
  "telemetry_requirements": {
    "required": [
      "run_id",
      "timestamp",
      "duration",
      "workflow_definition_id",
      "trace_id",
      "event_type",
      "status",
      "step_name",
      "agent_configuration_id",
      "agent_version",
      "configuration_hash"
    ],
    "optional": ["input_tokens", "output_tokens", "quality_score"]
  },
  "configuration": {
    "agent_configuration_id": "window-agent.v1",
    "agent_version": "2026-04-01",
    "configuration_hash": "sha256:window-agent-v1"
  },
  "taxonomy": {
    "deployment_mode": "synthetic_test",
    "workflow_integration": "offline_harness",
    "autonomy_level": "bounded_autonomy",
    "hitl_pattern": "none",
    "statefulness": "workflow_stateful",
    "memory_strategy": "trace_only",
    "composition": "single_agent",
    "decomposition_strategy": "fixed_steps",
    "allocation_mechanism": "static_assignment",
    "routing_strategy": "none",
    "protocol_surfaces": ["synthetic_jsonl"]
  },
  "inclusion_rules": ["Include runs fully contained in the measurement window."],
  "exclusion_rules": ["Exclude known manual tests and runs outside the window."],
  "run_exclusions": [
    {"run_id": "window-run-explicit", "reason": "known_manual_test"},
    {"run_id": "window-run-not-found", "reason": "requested_exclusion_absent"}
  ],
  "interpretation_boundaries": ["Exclusion results are deterministic governance evidence."],
  "concurrent_changes": []
}
